{"attestation_evidence":[],"claim_type":"metric","derivation_class":"measured","execution_env":"local-unattested","inputs":{"corpus_commitment":"abababababababababababababababababababababababababababababababab","evidence_window":{"end":"2026-01-31T00:00:00Z","start":"2026-01-01T00:00:00Z"}},"output":{"band":"medium","n_sessions_band":"10-99"},"registry_id":"transcript.tool_mix","registry_version":"0.1.0","scorer":{"measurement":null,"name":"mybench.tool_mix","version":"0.1.0"},"signature":"b9e4873bafc5bd3dace3e203927db00dca6ff6c66161fb34fa2e418efcccd6606d1f893b13123c0f457a29652506c92fc85cc1c5f4a6b90e83586fab86ec8506","signed_at":"2026-02-01T00:00:00Z","signer":{"kind":"dev","pub":"03a107bff3ce10be1d70dd18e74bc09967e4d6309ba50d5f1ddc8664125531b8"}}
